{
  "schema": "cwk.rt055.amendment11-qa.v1",
  "status": "PUBLIC_CLOSED_INVALID_VERIFIED",
  "source_commit": "fdfcfb6dfef57862cf5efd478e88820419e7c322",
  "terminal_decision": "INVALID",
  "selected_candidate": null,
  "old_request_failed_root_cause": "UNKNOWN",
  "public_defect_confirmed": "NATIVE_FINALIZING_REJECTED_AS_REQUEST_FAILED",
  "regression": {
    "tests": 265,
    "failures": 0,
    "errors": 0,
    "skipped": 0,
    "exit_code": 0
  },
  "compiled_files": 142,
  "behavior_mutation_detected": true,
  "restored_green": true,
  "formal_candidates_replayed": false,
  "formal_coordinator_invocations": 0,
  "candidate_attempts": {
    "a": 0,
    "b": 0
  },
  "after_claims": 1,
  "after_retried": false,
  "after_status": "FAIL",
  "after_reason": "FRESH_BEFORE_NOT_CREATED_PRIVACY_GATE_FAILED",
  "cleanup_failures": 0,
  "task_processes": 0,
  "runtime": 0,
  "independent_uuid_resources": 0,
  "independent_audit_exited": true,
  "retained_materials": 96,
  "history_files_verified": 390079,
  "history_bytes_equal": true,
  "builder_runs": 1,
  "verifier_runs": 1,
  "pool_counts": [
    42,
    31,
    42
  ],
  "formal_metrics_null": 120,
  "gateway_capabilities_null": 24,
  "new_privacy_log_streams_verified": 3,
  "old_candidate_log_streams_verified": 6,
  "old_controller_firewall_verified": false,
  "old_controller_firewall_error": "CHILD_NONZERO",
  "independent_log_hits": 0,
  "new_privacy_socket_observations": 108,
  "new_privacy_external_socket_observations": 1,
  "new_privacy_gate_passed": false,
  "workload_invocations": 0,
  "new_readiness_established": false,
  "full_nas_index_invariance": null,
  "historical_drift_cleared": false,
  "production_changes_performed": false,
  "main_agent_independently_reviewed_artifacts": true,
  "third_party_agent_review_claimed": false,
  "full_repository_ci_claimed": false,
  "schemas_validated": 8,
  "schema_negative_rejections": 1333,
  "private_field_or_digest_hits": 0,
  "credential_value_hits": 0,
  "historical_public_files_unchanged": 145,
  "historical_document_prefixes_preserved": 3,
  "links_checked": 222,
  "anchors_checked": 31,
  "aodw_exit_code": 0,
  "aodw_known_host_skill_warnings": 1,
  "governance_exit_code": 0,
  "governance_tracked_files": 998,
  "public_only_commits": true,
  "push_performed": false,
  "merge_performed": false,
  "worktree_removed": false
}
